{"$schema":"https://json-schema.org/draft/2020-12/schema","$id":"urn:agentj:longtask:brief:1","title":"brief v1","type":"object","additionalProperties":false,"properties":{"schema_version":{"const":1},"task_id":{"type":"string","pattern":"^[a-z0-9][a-z0-9.-]{0,79}$"},"revision":{"type":"integer","minimum":1},"goal":{"type":"string","minLength":1,"maxLength":500},"owner_request_ref":{"type":"string","pattern":"^(?!/)(?!.*(?:^|/)\\.\\.(?:/|$))[A-Za-z0-9][A-Za-z0-9_./-]{0,200}$"},"workflow_id":{"type":"string","pattern":"^[a-z0-9][a-z0-9.-]{0,79}$"},"context_refs":{"type":"array","items":{"type":"string","pattern":"^(?!/)(?!.*(?:^|/)\\.\\.(?:/|$))[A-Za-z0-9][A-Za-z0-9_./-]{0,200}$"},"minItems":0,"maxItems":30},"acceptance":{"type":"array","items":{"type":"object","additionalProperties":false,"properties":{"id":{"type":"string","pattern":"^[a-z0-9][a-z0-9.-]{0,79}$"},"criterion":{"type":"string","minLength":1,"maxLength":500},"evidence_expected":{"type":"string","minLength":1,"maxLength":500}},"required":["id","criterion","evidence_expected"]},"minItems":1,"maxItems":20},"capabilities":{"type":"array","items":{"type":"object","additionalProperties":false,"properties":{"id":{"type":"string","pattern":"^[a-z0-9][a-z0-9.-]{0,79}$"},"registry_revision":{"type":"integer","minimum":1},"required":{"type":"boolean"}},"required":["id","registry_revision","required"]},"minItems":0,"maxItems":50},"red_lines":{"type":"array","items":{"type":"string","minLength":1,"maxLength":500},"minItems":1,"maxItems":20},"deliverables":{"type":"array","items":{"type":"object","additionalProperties":false,"properties":{"path":{"type":"string","pattern":"^(?!/)(?!.*(?:^|/)\\.\\.(?:/|$))[A-Za-z0-9][A-Za-z0-9_./-]{0,200}$"},"format":{"enum":["markdown","json","pdf","html","other"]},"audience":{"enum":["owner","local"]}},"required":["path","format","audience"]},"minItems":1,"maxItems":20},"reporting":{"type":"array","items":{"type":"object","additionalProperties":false,"properties":{"when":{"enum":["milestone","delivery","blocked","failure"]},"message":{"type":"string","minLength":1,"maxLength":500}},"required":["when","message"]},"minItems":1,"maxItems":10},"plan":{"type":"object","additionalProperties":false,"properties":{"kind":{"enum":["once","weekly"]},"schedule_task_ref":{"anyOf":[{"type":"string","pattern":"^(?!/)(?!.*(?:^|/)\\.\\.(?:/|$))[A-Za-z0-9][A-Za-z0-9_./-]{0,200}$"},{"type":"null"}]},"timezone":{"type":"string","minLength":1,"maxLength":500},"human_enable_required":{"type":"boolean"}},"required":["kind","schedule_task_ref","timezone","human_enable_required"]},"failure_policy":{"type":"object","additionalProperties":false,"properties":{"safe_fallback":{"type":"string","minLength":1,"maxLength":500},"retry_limit":{"type":"integer","minimum":0,"maximum":5},"pause_dependent_only":{"const":true}},"required":["safe_fallback","retry_limit","pause_dependent_only"]},"confirmation":{"type":"object","additionalProperties":false,"properties":{"mode":{"enum":["requested","signed"]},"request_id":{"type":"string","pattern":"^[a-z0-9][a-z0-9.-]{0,79}$"},"receipt_ref":{"type":"string","pattern":"^(?!/)(?!.*(?:^|/)\\.\\.(?:/|$))[A-Za-z0-9][A-Za-z0-9_./-]{0,200}$"},"scope_digest":{"type":"string","pattern":"^[a-f0-9]{64}$"}},"required":["mode","request_id","receipt_ref","scope_digest"]}},"required":["schema_version","task_id","revision","goal","owner_request_ref","workflow_id","context_refs","acceptance","capabilities","red_lines","deliverables","reporting","plan","failure_policy","confirmation"],"allOf":[{"if":{"properties":{"plan":{"properties":{"kind":{"const":"weekly"}}}}},"then":{"properties":{"plan":{"properties":{"schedule_task_ref":{"type":"string","pattern":"^(?!/)(?!.*(?:^|/)\\.\\.(?:/|$))[A-Za-z0-9][A-Za-z0-9_./-]{0,200}$"},"human_enable_required":{"const":true}}},"confirmation":{"properties":{"mode":{"const":"signed"}}}}}}]}
